{
  "mnemonic": "FFEDTAR",
  "name": "Federal Funds Target Rate",
  "geography": "US",
  "source": "FRB",
  "category": "Interest Rates",
  "frequency": "Daily",
  "transformation": "None",
  "units": "Percent",
  "observations": [
    { "date": "2026-05-19", "value": 4.25 },
    { "date": "2026-05-20", "value": 4.25 },
    { "date": "2026-05-21", "value": 4.25 },
    { "date": "2026-05-22", "value": 4.00 }
  ]
}
